{
  "schema_version": 1,
  "planning_only": true,
  "map_id": "courtyard_01",
  "revision": 0,
  "layout_owner": "blender",
  "coordinate_system": "right_handed_y_up_xz_ground",
  "bounds": {
    "x_min": -14,
    "x_max": 14,
    "z_min": -10,
    "z_max": 10,
    "walk_surface_y": 0
  },
  "camera": {
    "follow_offset": [
      0,
      10,
      -10
    ],
    "vertical_fov_deg": 35,
    "resolution": [
      1280,
      720
    ]
  },
  "instances": [
    {
      "instance_id": "paving_0_0",
      "asset_id": "ENV001",
      "position": [
        -12,
        0,
        -8
      ],
      "rotation_quat": [
        0,
        0,
        0,
        1
      ],
      "scale": [
        1,
        1,
        1
      ],
      "material_variant": "stone_default",
      "occlusion_group": null
    },
    {
      "instance_id": "paving_0_1",
      "asset_id": "ENV001",
      "position": [
        -8,
        0,
        -8
      ],
      "rotation_quat": [
        0,
        0,
        0,
        1
      ],
      "scale": [
        1,
        1,
        1
      ],
      "material_variant": "stone_default",
      "occlusion_group": null
    },
    {
      "instance_id": "paving_0_2",
      "asset_id": "ENV001",
      "position": [
        -4,
        0,
        -8
      ],
      "rotation_quat": [
        0,
        0,
        0,
        1
      ],
      "scale": [
        1,
        1,
        1
      ],
      "material_variant": "stone_default",
      "occlusion_group": null
    },
    {
      "instance_id": "paving_0_3",
      "asset_id": "ENV001",
      "position": [
        0,
        0,
        -8
      ],
      "rotation_quat": [
        0,
        0,
        0,
        1
      ],
      "scale": [
        1,
        1,
        1
      ],
      "material_variant": "stone_default",
      "occlusion_group": null
    },
    {
      "instance_id": "paving_0_4",
      "asset_id": "ENV001",
      "position": [
        4,
        0,
        -8
      ],
      "rotation_quat": [
        0,
        0,
        0,
        1
      ],
      "scale": [
        1,
        1,
        1
      ],
      "material_variant": "stone_default",
      "occlusion_group": null
    },
    {
      "instance_id": "paving_0_5",
      "asset_id": "ENV001",
      "position": [
        8,
        0,
        -8
      ],
      "rotation_quat": [
        0,
        0,
        0,
        1
      ],
      "scale": [
        1,
        1,
        1
      ],
      "material_variant": "stone_default",
      "occlusion_group": null
    },
    {
      "instance_id": "paving_0_6",
      "asset_id": "ENV001",
      "position": [
        12,
        0,
        -8
      ],
      "rotation_quat": [
        0,
        0,
        0,
        1
      ],
      "scale": [
        1,
        1,
        1
      ],
      "material_variant": "stone_default",
      "occlusion_group": null
    },
    {
      "instance_id": "paving_1_0",
      "asset_id": "ENV001",
      "position": [
        -12,
        0,
        -4
      ],
      "rotation_quat": [
        0,
        0,
        0,
        1
      ],
      "scale": [
        1,
        1,
        1
      ],
      "material_variant": "stone_default",
      "occlusion_group": null
    },
    {
      "instance_id": "paving_1_1",
      "asset_id": "ENV001",
      "position": [
        -8,
        0,
        -4
      ],
      "rotation_quat": [
        0,
        0,
        0,
        1
      ],
      "scale": [
        1,
        1,
        1
      ],
      "material_variant": "stone_default",
      "occlusion_group": null
    },
    {
      "instance_id": "paving_1_2",
      "asset_id": "ENV001",
      "position": [
        -4,
        0,
        -4
      ],
      "rotation_quat": [
        0,
        0,
        0,
        1
      ],
      "scale": [
        1,
        1,
        1
      ],
      "material_variant": "stone_default",
      "occlusion_group": null
    },
    {
      "instance_id": "paving_1_3",
      "asset_id": "ENV001",
      "position": [
        0,
        0,
        -4
      ],
      "rotation_quat": [
        0,
        0,
        0,
        1
      ],
      "scale": [
        1,
        1,
        1
      ],
      "material_variant": "stone_default",
      "occlusion_group": null
    },
    {
      "instance_id": "paving_1_4",
      "asset_id": "ENV001",
      "position": [
        4,
        0,
        -4
      ],
      "rotation_quat": [
        0,
        0,
        0,
        1
      ],
      "scale": [
        1,
        1,
        1
      ],
      "material_variant": "stone_default",
      "occlusion_group": null
    },
    {
      "instance_id": "paving_1_5",
      "asset_id": "ENV001",
      "position": [
        8,
        0,
        -4
      ],
      "rotation_quat": [
        0,
        0,
        0,
        1
      ],
      "scale": [
        1,
        1,
        1
      ],
      "material_variant": "stone_default",
      "occlusion_group": null
    },
    {
      "instance_id": "paving_1_6",
      "asset_id": "ENV001",
      "position": [
        12,
        0,
        -4
      ],
      "rotation_quat": [
        0,
        0,
        0,
        1
      ],
      "scale": [
        1,
        1,
        1
      ],
      "material_variant": "stone_default",
      "occlusion_group": null
    },
    {
      "instance_id": "paving_2_0",
      "asset_id": "ENV001",
      "position": [
        -12,
        0,
        0
      ],
      "rotation_quat": [
        0,
        0,
        0,
        1
      ],
      "scale": [
        1,
        1,
        1
      ],
      "material_variant": "stone_default",
      "occlusion_group": null
    },
    {
      "instance_id": "paving_2_1",
      "asset_id": "ENV001",
      "position": [
        -8,
        0,
        0
      ],
      "rotation_quat": [
        0,
        0,
        0,
        1
      ],
      "scale": [
        1,
        1,
        1
      ],
      "material_variant": "stone_default",
      "occlusion_group": null
    },
    {
      "instance_id": "paving_2_2",
      "asset_id": "ENV001",
      "position": [
        -4,
        0,
        0
      ],
      "rotation_quat": [
        0,
        0,
        0,
        1
      ],
      "scale": [
        1,
        1,
        1
      ],
      "material_variant": "stone_default",
      "occlusion_group": null
    },
    {
      "instance_id": "paving_2_3",
      "asset_id": "ENV001",
      "position": [
        0,
        0,
        0
      ],
      "rotation_quat": [
        0,
        0,
        0,
        1
      ],
      "scale": [
        1,
        1,
        1
      ],
      "material_variant": "stone_default",
      "occlusion_group": null
    },
    {
      "instance_id": "paving_2_4",
      "asset_id": "ENV001",
      "position": [
        4,
        0,
        0
      ],
      "rotation_quat": [
        0,
        0,
        0,
        1
      ],
      "scale": [
        1,
        1,
        1
      ],
      "material_variant": "stone_default",
      "occlusion_group": null
    },
    {
      "instance_id": "paving_2_5",
      "asset_id": "ENV001",
      "position": [
        8,
        0,
        0
      ],
      "rotation_quat": [
        0,
        0,
        0,
        1
      ],
      "scale": [
        1,
        1,
        1
      ],
      "material_variant": "stone_default",
      "occlusion_group": null
    },
    {
      "instance_id": "paving_2_6",
      "asset_id": "ENV001",
      "position": [
        12,
        0,
        0
      ],
      "rotation_quat": [
        0,
        0,
        0,
        1
      ],
      "scale": [
        1,
        1,
        1
      ],
      "material_variant": "stone_default",
      "occlusion_group": null
    },
    {
      "instance_id": "paving_3_0",
      "asset_id": "ENV001",
      "position": [
        -12,
        0,
        4
      ],
      "rotation_quat": [
        0,
        0,
        0,
        1
      ],
      "scale": [
        1,
        1,
        1
      ],
      "material_variant": "stone_default",
      "occlusion_group": null
    },
    {
      "instance_id": "paving_3_1",
      "asset_id": "ENV001",
      "position": [
        -8,
        0,
        4
      ],
      "rotation_quat": [
        0,
        0,
        0,
        1
      ],
      "scale": [
        1,
        1,
        1
      ],
      "material_variant": "stone_default",
      "occlusion_group": null
    },
    {
      "instance_id": "paving_3_2",
      "asset_id": "ENV001",
      "position": [
        -4,
        0,
        4
      ],
      "rotation_quat": [
        0,
        0,
        0,
        1
      ],
      "scale": [
        1,
        1,
        1
      ],
      "material_variant": "stone_default",
      "occlusion_group": null
    },
    {
      "instance_id": "paving_3_3",
      "asset_id": "ENV001",
      "position": [
        0,
        0,
        4
      ],
      "rotation_quat": [
        0,
        0,
        0,
        1
      ],
      "scale": [
        1,
        1,
        1
      ],
      "material_variant": "stone_default",
      "occlusion_group": null
    },
    {
      "instance_id": "paving_3_4",
      "asset_id": "ENV001",
      "position": [
        4,
        0,
        4
      ],
      "rotation_quat": [
        0,
        0,
        0,
        1
      ],
      "scale": [
        1,
        1,
        1
      ],
      "material_variant": "stone_default",
      "occlusion_group": null
    },
    {
      "instance_id": "paving_3_5",
      "asset_id": "ENV001",
      "position": [
        8,
        0,
        4
      ],
      "rotation_quat": [
        0,
        0,
        0,
        1
      ],
      "scale": [
        1,
        1,
        1
      ],
      "material_variant": "stone_default",
      "occlusion_group": null
    },
    {
      "instance_id": "paving_3_6",
      "asset_id": "ENV001",
      "position": [
        12,
        0,
        4
      ],
      "rotation_quat": [
        0,
        0,
        0,